{
  "id": "S09b",
  "name": "framework-conditional-package",
  "phase": 1,
  "entry": "FrameworkConditional.csproj",
  "restore": {
    "mode": "locked",
    "expectSuccess": true
  },
  "deterministic": true,
  "nightly": false,
  "checks": [
    "frameworks",
    "conditionalAbsence",
    "nodes",
    "edges",
    "paths"
  ]
}
