{
  "id": "S18",
  "name": "vulnerable-transitive",
  "phase": 2,
  "entry": "VulnerableTransitive.csproj",
  "restore": {
    "mode": "locked",
    "expectSuccess": true
  },
  "deterministic": false,
  "nightly": true,
  "checks": [
    "nodes",
    "edges",
    "paths",
    "directFlags",
    "frameworks"
  ],
  "vulnerabilityPackages": [
    "Newtonsoft.Json"
  ]
}
