{
  "id": "S06b",
  "name": "direct-wins-logging",
  "phase": 1,
  "entry": "DirectWinsLogging.csproj",
  "restore": {
    "mode": "locked",
    "expectSuccess": true
  },
  "deterministic": true,
  "nightly": false,
  "checks": [
    "nodes",
    "edges",
    "paths",
    "directFlags",
    "frameworks"
  ]
}
