{
  "id": "S22b",
  "name": "large-real-graph",
  "phase": 3,
  "entry": "LargeRealGraph.csproj",
  "restore": {
    "mode": "locked",
    "expectSuccess": true
  },
  "deterministic": false,
  "nightly": true,
  "checks": [
    "nodes",
    "edges",
    "paths",
    "directFlags",
    "frameworks"
  ]
}
